{
  "checked": false,
  "dimensions": {
    "width": 5,
    "height": 10
  },
  "id": 1,
  "name": "A green door",
  "price": 12.5,
  "tags": [
    "home",
    "green"
  ],
  "person": {
    "firstname": "Marcel",
    "lastname": "Durant",
    "address": {
      "street": "rue du couvent",
      "number": 4
    }
  }
}
